,id,title,overview,release_date,popularity,vote_average,vote_count
604,11010,The Postman,Simple Italian postman learns to love poetry while delivering mail to a famous poet; he uses this to woo local beauty Beatrice.,1994-04-07,7.701,8.0,922
605,7857,Amarcord,"In an Italian seaside town, young Titta gets into trouble with his friends and watches various local eccentrics as they engage in often absurd behavior. Frequently clashing with his stern father and defended by his doting mother, Titta witnesses the actions of a wide range of characters, from his extended family to Fascist loyalists to sensual women, with certain moments shifting into fantastical scenarios.",1973-12-13,7.996,8.0,852
606,5925,The Great Escape,"The Nazis, exasperated at the number of escapes from their prison camps by a relatively small number of Allied prisoners, relocate them to a high-security 'escape-proof' camp to sit out the remainder of the war. Undaunted, the prisoners plan one of the most ambitious escape attempts of World War II. Based on a true story.",1963-06-20,16.402,7.9,1998
607,152532,Dallas Buyers Club,"Loosely based on the true-life tale of Ron Woodroof, a drug-taking, women-loving, homophobic man who in 1986 was diagnosed with HIV/AIDS and given thirty days to live.",2013-11-01,15.469,7.9,7370
608,745,The Sixth Sense,"Following an unexpected tragedy, a child psychologist named Malcolm Crowe meets an nine year old boy named Cole Sear, who is hiding a dark secret.",1999-08-06,60.792,7.9,9610
609,316029,The Greatest Showman,"The story of American showman P.T. Barnum, founder of the circus that became the famous traveling Ringling Bros. and Barnum & Bailey Circus.",2017-12-20,42.543,7.9,8155
610,491480,The Boy Who Harnessed the Wind,"Against all the odds, a thirteen year old boy in Malawi invents an unconventional way to save his family and village from famine.",2019-02-14,34.739,7.9,1287
611,160885,Tel chi el telùn,A comedy show.,1999-05-12,4.342,7.9,295
612,508943,Luca,Luca and his best friend Alberto experience an unforgettable summer on the Italian Riviera. But all the fun is threatened by a deeply-held secret: they are sea monsters from another world just below the water’s surface.,2021-06-17,341.544,7.9,6376
613,14160,Up,"Carl Fredricksen spent his entire life dreaming of exploring the globe and experiencing life to its fullest. But at age 78, life seems to have passed him by, until a twist of fate (and a persistent 8-year old Wilderness Explorer named Russell) gives him a new lease on life.",2009-05-28,119.195,7.9,17276
614,548544,Invisible Life,"Rio de Janeiro, Brazil, 1950. In the conservative home of the Gusmão family, Eurídice and Guida are two inseparable sisters who support each other. While Guida can share with her younger sister the details of her romantic adventures, Eurídice finds in her older sister the encouragement she needs to pursue her dream of becoming a professional pianist.",2019-08-30,6.645,7.9,243
615,9323,Ghost in the Shell,"In the year 2029, the barriers of our world have been broken down by the net and by cybernetics, but this brings new vulnerability to humans in the form of brain-hacking. When a highly-wanted hacker known as 'The Puppetmaster' begins involving them in politics, Section 9, a group of cybernetically enhanced cops, are called in to investigate and stop the Puppetmaster.",1995-11-18,31.87,7.9,2562
616,3083,Mr. Smith Goes to Washington,"Naive and idealistic Jefferson Smith, leader of the Boy Rangers, is appointed to the United States Senate by the puppet governor of his state. He soon discovers, upon going to Washington, many shortcomings of the political process as his earnest goal of a national boys' camp leads to a conflict with the state political boss.",1939-10-19,8.858,7.9,796
617,2011,Persepolis,"In 1970s Iran, Marjane 'Marji' Statrapi watches events through her young eyes and her idealistic family of a long dream being fulfilled of the hated Shah's defeat in the Iranian Revolution of 1979. However as Marji grows up, she witnesses first hand how the new Iran, now ruled by Islamic fundamentalists, has become a repressive tyranny on its own.",2007-06-27,8.643,7.9,1540
618,223,Rebecca,"Story of a young woman who marries a fascinating widower only to find out that she must live in the shadow of his former wife, Rebecca, who died mysteriously several years earlier. The young wife must come to grips with the terrible secret of her handsome, cold husband, Max De Winter. She must also deal with the jealous, obsessed Mrs. Danvers, the housekeeper, who will not accept her as the mistress of the house.",1940-03-23,10.354,7.9,1316
619,3034,Young Frankenstein,"A young neurosurgeon inherits the castle of his grandfather, the famous Dr. Victor von Frankenstein. In the castle he finds a funny hunchback, a pretty lab assistant and the elderly housekeeper. Young Frankenstein believes that the work of his grandfather was delusional, but when he discovers the book where the mad doctor described his reanimation experiment, he suddenly changes his mind.",1974-12-15,10.205,7.9,2579
620,334533,Captain Fantastic,A father living in the forests of the Pacific Northwest with his six young kids tries to assimilate back into society.,2016-07-08,41.165,7.9,5451
621,32085,Vincent,Young Vincent Malloy dreams of being just like Vincent Price and loses himself in macabre daydreams that annoy his mother.,1982-10-01,6.083,7.9,705
622,1646,Freedom Writers,"A young teacher inspires her class of at-risk students to learn tolerance, apply themselves, and pursue education beyond high school.",2007-01-05,26.785,7.9,1799
623,662,La Jetée,A man is sent back and forth and in and out of time in an experiment that attempts to unravel the fate and the solution to the problems of a post-apocalyptic world during the aftermath of WW3. The experiment results in him getting caught up in a perpetual reminiscence of past events that are recreated on an airport’s viewing pier.,1962-02-16,7.817,7.9,665
624,43949,Flipped,"When Juli meets Bryce in the second grade, she knows it's true love. After spending six years trying to convince Bryce the same, she's ready to give up - until he starts to reconsider.",2010-08-06,33.03,7.9,2213
625,33,Unforgiven,"William Munny is a retired, once-ruthless killer turned gentle widower and hog farmer. To help support his two motherless children, he accepts one last bounty-hunter mission to find the men who brutalized a prostitute. Joined by his former partner and a cocky greenhorn, he takes on a corrupt sheriff.",1992-08-07,20.343,7.9,3429
626,150540,Inside Out,"Growing up can be a bumpy road, and it's no exception for Riley, who is uprooted from her Midwest life when her father starts a new job in San Francisco. Riley's guiding emotions— Joy, Fear, Anger, Disgust and Sadness—live in Headquarters, the control centre inside Riley's mind, where they help advise her through everyday life and tries to keep things positive, but the emotions conflict on how best to navigate a new city, house and school.",2015-06-09,98.022,7.9,17933
627,78,Blade Runner,"In the smog-choked dystopian Los Angeles of 2019, blade runner Rick Deckard is called out of retirement to terminate a quartet of replicants who have escaped to Earth seeking their creator for a way to extend their short life spans.",1982-06-25,35.639,7.9,11513
628,10674,Mulan,"A tomboyish girl disguises herself as a young man so she can fight with the Imperial Chinese Army against the invading Huns. With help from wise-cracking dragon Mushu, Mulan just might save her country - and win the heart of the handsome Captain Li Shang.",1998-06-18,122.119,7.9,8090
629,197,Braveheart,"Enraged at the slaughter of Murron, his new bride and childhood love, Scottish warrior William Wallace slays a platoon of the local English lord's soldiers. This leads the village to revolt and, eventually, the entire country to rise up against English rule.",1995-03-14,37.743,7.9,8420
630,6977,No Country for Old Men,"Llewelyn Moss stumbles upon dead bodies, $2 million and a hoard of heroin in a Texas desert, but methodical killer Anton Chigurh comes looking for it, with local sheriff Ed Tom Bell hot on his trail. The roles of prey and predator blur as the violent pursuit of money and justice collide.",2007-06-13,25.366,7.9,9762
631,48035,Ordet,"The three sons of devout Danish farmer Morten have widely disparate religious beliefs. Youngest son Anders shares his father's religion, but eldest son Mikkel has lost his faith, while middle child Johannes has become delusional and proclaims that he is Jesus Christ himself. When Mikkel's wife, Inger goes into a difficult childbirth, everyone's beliefs are put to the test.",1955-01-09,7.766,7.9,263
632,435129,The Breadwinner,"A headstrong young girl in Afghanistan, ruled by the Taliban, disguises herself as a boy in order to provide for her family.",2017-11-17,15.093,7.9,618
633,60243,A Separation,A married couple are faced with a difficult decision - to improve the life of their child by moving to another country or to stay in Iran and look after a deteriorating parent who has Alzheimer's disease.,2011-03-15,10.414,7.9,1339
634,8290,La Grande Vadrouille,"During World War II, two French civilians and a downed British Bomber Crew set out from Paris to cross the demarcation line between Nazi-occupied Northern France and the South. From there they will be able to escape to England. First, they must avoid German troops - and the consequences of their own blunders.",1966-12-08,11.299,7.9,1046
635,615453,Ne Zha,"The Primus extracts a Mixed Yuan Bead into a Spirit Seed and a Demon Pill. The Spirit Seed can be reincarnated as a human to help King Zhou establish a new dynasty, whereas the Demon Pill will create a devil threatening humanity. Ne Zha is the one who is destined to be the hero, but instead he becomes a devil incarnate, because the Spirit Seed and a Demon Pill are switched.",2019-07-26,25.177,7.9,270
636,24167,Two Women,"Widowed shopkeeper Cesira and her 13-year-old daughter Rosetta flee from the allied bombs in Rome during the second World War; they travel to the remote village where Cesira was born. During their journey and in the village and onward, the mother does everything she can to protect Rosetta. Meanwhile, a sensitive young intellectual, Michele, falls in love with Cesira.",1960-12-22,9.917,7.9,417
637,829,Chinatown,"Private eye Jake Gittes lives off of the murky moral climate of sunbaked, pre-World War II Southern California. Hired by a beautiful socialite to investigate her husband's extra-marital affair, Gittes is swept into a maelstrom of double dealings and deadly deceits, uncovering a web of personal and political scandals that come crashing together.",1974-06-20,18.447,7.9,2981
638,183011,Justice League: The Flashpoint Paradox,The Flash finds himself in a war-torn alternate timeline and teams up with alternate versions of his fellow heroes to restore the timeline.,2013-07-30,45.471,7.9,1459
639,85,Raiders of the Lost Ark,"When Dr. Indiana Jones – the tweed-suited professor who just happens to be a celebrated archaeologist – is hired by the government to locate the legendary Ark of the Covenant, he finds himself up against the entire Nazi regime.",1981-06-12,32.82,7.9,10137
640,81,Nausicaä of the Valley of the Wind,"After a global war, the seaside kingdom known as the Valley of the Wind remains one of the last strongholds on Earth untouched by a poisonous jungle and the powerful insects that guard it. Led by the courageous Princess Nausicaä, the people of the Valley engage in an epic struggle to restore the bond between humanity and Earth.",1984-03-11,28.783,7.9,2709
641,367412,Whiplash,"A ferocious, bullying music teacher teaches a dedicated student. This is the 18 minute short film that the feature film was based on.",2013-01-18,6.7,7.9,254
642,25364,Ace in the Hole,An arrogant reporter exploits a story about a man trapped in a cave to revitalize his career.,1951-06-29,6.943,7.9,485
643,329,Jurassic Park,"A wealthy entrepreneur secretly creates a theme park featuring living dinosaurs drawn from prehistoric DNA. Before opening day, he invites a team of experts and his two eager grandchildren to experience the park and help calm anxious investors. However, the park is anything but amusing as the security systems go off-line and the dinosaurs escape.",1993-06-11,128.783,7.9,13626
644,613868,Cousins,"Lucas is a young man who lives with his religious aunt Lourdes in a quiet country town. He helps his aunt by holding religious meetings with the ladies of the area, in the living room, playing biblical songs on the keyboard. This quiet life will end as soon as the charitable aunt communicates the arrival of another nephew, Mario, just out of jail. The clash of reality between the cousins ends up causing unusual situations, and an unexpected attraction among the boys.",2019-12-10,10.231,7.9,239
645,10386,The Iron Giant,"In the small town of Rockwell, Maine in October 1957, a giant metal machine befriends a nine-year-old boy and ultimately finds its humanity by unselfishly saving people from their own fears and prejudices.",1999-08-06,62.614,7.9,4549
646,671,Harry Potter and the Philosopher's Stone,"Harry Potter has lived under the stairs at his aunt and uncle's house his whole life. But on his 11th birthday, he learns he's a powerful wizard—with a place waiting for him at the Hogwarts School of Witchcraft and Wizardry. As he learns to harness his newfound powers with the help of the school's kindly headmaster, Harry uncovers the truth about his parents' deaths—and about the villain who's to blame.",2001-11-16,335.853,7.9,22746
647,10728,Faust,"God and Satan war over earth; to settle things, they wager on the soul of Faust, a learned and prayerful alchemist.",1926-10-13,6.801,7.9,254
648,331482,Little Women,Four sisters come of age in America in the aftermath of the Civil War.,2019-12-25,39.788,7.9,4860
649,16390,Scooby-Doo! and the Samurai Sword,"The Mystery Inc. gang takes a trip to Japan and finds themselves circling Asia and the Pacific in a treasure hunt, racing against the vengeful Black Samurai and his Ninja warriors to find the legendary Sword of Fate, an ancient blade fabled to possess extraordinary supernatural powers.",2009-04-07,14.08,7.9,203
650,7984,In the Name of the Father,"A small time thief from Belfast, Gerry Conlon, is falsely implicated in the IRA bombing of a pub that kills several people while he is in London. He and his four friends are coerced by British police into confessing their guilt. Gerry's father and other relatives in London are also implicated in the crime. He spends fifteen years in prison with his father trying to prove his innocence.",1993-12-12,12.237,7.9,1363
651,198,To Be or Not to Be,"During the Nazi occupation of Poland, an acting troupe becomes embroiled in a Polish soldier's efforts to track down a German spy.",1942-03-05,9.854,7.9,506
652,3112,The Night of the Hunter,"In the Deep South, a serial-killing preacher hunts two young children who know the whereabouts of a stash of money.",1955-08-26,9.245,7.9,1189
653,946,Letter from an Unknown Woman,"A pianist about to flee from a duel receives a letter from a woman he cannot remember. As she tells the story of her lifelong love for him, he is forced to reinterpret his own past.",1948-04-28,6.022,7.9,227
654,679,Aliens,"When Ripley's lifepod is found by a salvage crew over 50 years later, she finds that terra-formers are on the very planet they found the alien species. When the company sends a family of colonists out to investigate her story—all contact is lost with the planet and colonists. They enlist Ripley and the colonial marines to return and search for answers.",1986-07-18,40.409,7.9,7735
655,31442,Ivan's Childhood,"In WW2, twelve year old Soviet orphan Ivan Bondarev works for the Soviet army as a scout behind the German lines and strikes a friendship with three sympathetic Soviet officers.",1962-05-09,7.484,7.9,512
656,1892,Return of the Jedi,"Luke Skywalker leads a mission to rescue his friend Han Solo from the clutches of Jabba the Hutt, while the Emperor seeks to destroy the Rebellion once and for all with a second dreaded Death Star.",1983-05-25,28.98,7.9,12847
657,194,Amélie,"At a tiny Parisian café, the adorable yet painfully shy Amélie accidentally discovers a gift for helping others. Soon Amelie is spending her days as a matchmaker, guardian angel, and all-around do-gooder. But when she bumps into a handsome stranger, will she find the courage to become the star of her very own love story?",2001-04-25,25.55,7.9,9761
658,118340,Guardians of the Galaxy,"Light years from Earth, 26 years after being abducted, Peter Quill finds himself the prime target of a manhunt after discovering an orb wanted by Ronan the Accuser.",2014-07-30,60.759,7.9,24534
659,3870,1900,"The epic tale of a class struggle in twentieth century Italy, as seen through the eyes of two childhood friends on opposing sides.",1976-09-03,12.771,7.9,485
660,369557,Sing Street,A boy growing up in Dublin during the 1980s escapes his strained family life by starting a band to impress the mysterious girl he likes.,2016-03-11,10.769,7.9,1912
661,726684,Miraculous World: Shanghai – The Legend of Ladydragon,"On school break, Marinette heads to Shanghai to meet Adrien. But after arriving, Marinette loses all her stuff, including the Miraculous that allows her to turn into Ladybug!",2021-05-15,313.44,7.9,448
662,564427,Minha Vida em Marte,"With the help of her best friend, Fernanda now has to deal with the perks of being married, or perhaps unmarried.",2018-12-27,5.46,7.9,261
663,122906,About Time,"The night after another unsatisfactory New Year's party, Tim's father tells his son that the men in his family have always had the ability to travel through time. They can't change history, but they can change what happens and has happened in their own lives. Thus begins the start of a lesson in learning to appreciate life itself as it is, as it comes, and most importantly, the people living alongside us.",2013-09-04,35.433,7.9,6954
664,47796,Mamma Roma,"After years spent working as a prostitute in her Italian village, middle-aged Mamma Roma has saved enough money to buy herself a fruit stand so that she can have a respectable middle-class life and reestablish contact with the 16-year-old son she abandoned when he was an infant. But her former pimp threatens to expose her sordid past, and her troubled son seems destined to fall into a life of crime and violence.",1962-09-22,7.092,7.9,295
665,1402,The Pursuit of Happyness,A struggling salesman takes custody of his son as he's poised to begin a life-changing professional career.,2006-12-14,34.509,7.9,8295
666,746957,You've Got This,An ad creative and a successful exec have a great marriage — until he wants to be a dad just as her star is rising. Then he brings someone new home.,2020-10-02,9.688,7.9,253
667,2721,Z,"Repression is the rule of the day in this film that skewers Greek governance of the 1960s. Z, a leftist rabble rouser, is killed in what appears to be a traffic accident. But given the political climate, the death of such a prominent activist raises troubling questions. Though it's too late to save Z's life, a postmortem examination suggests that the ruling party was behind his death. As the facts leak out, those who tell the truth pay the price for their honesty.",1969-02-26,8.045,7.9,313
668,37797,Whisper of the Heart,"Shizuku lives a simple life, dominated by her love for stories and writing. One day she notices that all the library books she has have been previously checked out by the same person: 'Seiji Amasawa'.",1995-07-15,44.055,7.9,1451
669,804,Roman Holiday,"Overwhelmed by her suffocating schedule, touring European princess Ann takes off for a night while in Rome. When a sedative she took from her doctor kicks in, however, she falls asleep on a park bench and is found by an American reporter, Joe Bradley, who takes her back to his apartment for safety. At work the next morning, Joe finds out Ann's regal identity and bets his editor he can get exclusive interview with her, but romance soon gets in the way.",1953-08-26,14.194,7.9,1578
670,56231,The Working Class Goes to Heaven,A conscientious factory worker gets his finger cut off by a machine. The accident causes him to become more involved in political and revolutionary groups.,1971-09-17,5.683,7.9,274
671,631,Sunrise: A Song of Two Humans,"A married farmer falls under the spell of a slatternly woman from the city, who tries to convince him to drown his wife.",1927-11-04,7.899,7.9,597
672,301,Rio Bravo,"The sheriff of a small town in southwest Texas must keep custody of a murderer whose brother, a powerful rancher, is trying to help him escape. After a friend is killed trying to muster support for him, he and his deputies - a disgraced drunk and a cantankerous old cripple - must find a way to hold out against the rancher's hired guns until the marshal arrives. In the meantime, matters are complicated by the presence of a young gunslinger - and a mysterious beauty who just came in on the last stagecoach.",1959-03-17,16.654,7.9,858
673,45523,Louis C.K.: Hilarious,"In this unique and dynamic live concert experience, Louis C.K.'s exploration of life after 40 destroys politically correct images of modern life with thoughts we have all had...but would rarely admit to.",2010-01-26,4.746,7.9,215
674,3078,It Happened One Night,"A renegade reporter and a crazy young heiress meet on a bus heading for New York, and end up stuck with each other when the bus leaves them behind at one of the stops.",1934-02-22,9.196,7.9,920
675,16,Dancer in the Dark,"Selma, a Czech immigrant on the verge of blindness, struggles to make ends meet for herself and her son, who has inherited the same genetic disorder and will suffer the same fate without an expensive operation. When life gets too difficult, Selma learns to cope through her love of musicals, escaping life's troubles - even if just for a moment - by dreaming up little numbers to the rhythmic beats of her surroundings.",2000-06-30,12.687,7.9,1415
676,579245,The Specials,"For twenty years, Bruno and Malik have lived in a different world—the world of autistic children and teens. In charge of two separate nonprofit organizations (The Hatch & The Shelter), they train young people from underprivileged areas to be caregivers for extreme cases that have been refused by all other institutions. It’s an exceptional partnership, outside of traditional settings, for some quite extraordinary characters.",2019-10-23,10.556,7.9,714
677,752,V for Vendetta,"In a world in which Great Britain has become a fascist state, a masked vigilante known only as “V” conducts guerrilla warfare against the oppressive British government. When V rescues a young woman from the secret police, he finds in her an ally with whom he can continue his fight to free the people of Britain.",2006-02-23,30.86,7.9,12281
678,379170,Sherlock: The Abominable Bride,Sherlock Holmes and Dr. Watson find themselves in 1890s London in this holiday special.,2016-01-01,24.064,7.9,2006
679,25538,Yi Yi,Each member of a family in Taipei asks hard questions about life's meaning as they live through everyday quandaries.,2000-09-20,9.275,7.9,368
680,949,Heat,Obsessive master thief Neil McCauley leads a top-notch crew on various daring heists throughout Los Angeles while determined detective Vincent Hanna pursues him without rest. Each man recognizes and respects the ability and the dedication of the other even though they are aware their cat-and-mouse game may end in violence.,1995-12-15,37.293,7.9,5557
681,83564,La luna,"A young boy comes of age in the most peculiar of circumstances. Tonight is the very first time his Papa and Grandpa are taking him to work. In an old wooden boat they row far out to sea, and with no land in sight, they stop and wait. A big surprise awaits the boy as he discovers his family's most unusual line of work. Should he follow the example of his Papa, or his Grandpa? Will he be able to find his own way in the midst of their conflicting opinions and timeworn traditions?",2012-02-10,6.057,7.9,655
682,404378,A Street Cat Named Bob,"James Bowen, a homeless busker and recovering drug addict, has his life transformed when he meets a stray ginger cat.",2016-11-04,11.652,7.9,1131
683,296096,Me Before You,"A small town girl is caught between dead-end jobs. A high-profile, successful man becomes wheelchair bound following an accident. The man decides his life is not worth living until the girl is hired for six months to be his new caretaker. Worlds apart and trapped together by circumstance, the two get off to a rocky start. But the girl becomes determined to prove to the man that life is worth living and as they embark on a series of adventures together, each finds their world changing in ways neither of them could begin to imagine.",2016-06-01,135.365,7.9,10198
684,210577,Gone Girl,"With his wife's disappearance having become the focus of an intense media circus, a man sees the spotlight turned on him when it's suspected that he may not be innocent.",2014-10-01,45.323,7.9,15877
685,602063,Rurouni Kenshin: The Final,"In 1879, Kenshin and his allies face their strongest enemy yet: his former brother-in-law Enishi Yukishiro and his minions, who've vowed their revenge.",2021-04-23,58.274,7.9,325
686,13398,Tokyo Godfathers,"During a Christmas Eve in Tokyo, three homeless people, middle-aged alcoholic Gin, former drag queen Hana, and dependent runaway girl Miyuki, discover an abandoned newborn while looking through the garbage. With only a handful of clues to the baby's identity, the three misfits search the city to find its parents.",2003-12-29,11.005,7.9,836
