,id,title,overview,release_date,popularity,vote_average,vote_count
0,278,The Shawshank Redemption,"Framed in the 1940s for the double murder of his wife and her lover, upstanding banker Andy Dufresne begins a new life at the Shawshank prison, where he puts his accounting skills to work for an amoral warden. During his long stretch in prison, Dufresne comes to be admired by the other inmates -- including an older prisoner named Red -- for his integrity and unquenchable sense of hope.",1994-09-23,63.825,8.7,21628
1,19404,Dilwale Dulhania Le Jayenge,"Raj is a rich, carefree, happy-go-lucky second generation NRI. Simran is the daughter of Chaudhary Baldev Singh, who in spite of being an NRI is very strict about adherence to Indian values. Simran has left for India to be married to her childhood fiancé. Raj leaves for India with a mission at his hands, to claim his lady love under the noses of her whole family. Thus begins a saga.",1995-10-20,19.536,8.7,3688
2,238,The Godfather,"Spanning the years 1945 to 1955, a chronicle of the fictional Italian-American Corleone crime family. When organized crime family patriarch, Vito Corleone barely survives an attempt on his life, his youngest son, Michael steps in to take care of the would-be killers, launching a campaign of bloody revenge.",1972-03-14,83.36,8.7,16106
3,424,Schindler's List,The true story of how businessman Oskar Schindler saved over a thousand Jewish lives from the Nazis while they worked as slaves in his factory during World War II.,1993-11-30,49.832,8.6,12874
4,240,The Godfather: Part II,"In the continuing saga of the Corleone crime family, a young Vito Corleone grows up in Sicily and in 1910s New York. In the 1950s, Michael Corleone attempts to expand the family business into Las Vegas, Hollywood and Cuba.",1974-12-20,53.917,8.6,9712
5,372754,Dou kyu sei – Classmates,"Rihito Sajo, an honor student with a perfect score on the entrance exam and Hikaru Kusakabe, in a band and popular among girls, would have never crossed paths. Until one day they started talking at the practice for their school’s upcoming chorus festival. After school, the two meet regularly, as Hikaru helps Rihito to improve his singing skills. While they listen to each other’s voice and harmonize, their hearts start to beat together.",2016-02-20,13.317,8.6,233
6,667257,Impossible Things,A widow who is tormented by the memory of her abusive husband befriends a young man.,2021-06-17,17.445,8.5,248
7,129,Spirited Away,"A young girl, Chihiro, becomes trapped in a strange new world of spirits. When her parents undergo a mysterious transformation, she must call upon the courage she never knew she had to free her family.",2001-07-20,83.633,8.5,12961
8,372058,Your Name.,"High schoolers Mitsuha and Taki are complete strangers living separate lives. But one night, they suddenly switch places. Mitsuha wakes up in Taki’s body, and he in hers. This bizarre occurrence continues to happen randomly, and the two must adjust their lives around each other.",2016-08-26,187.969,8.5,8804
9,696374,Gabriel's Inferno,"An intriguing and sinful exploration of seduction, forbidden love, and redemption, Gabriel's Inferno is a captivating and wildly passionate tale of one man's escape from his own personal hell as he tries to earn the impossible--forgiveness and love.",2020-05-29,21.99,8.5,2249
10,496243,Parasite,"All unemployed, Ki-taek's family takes peculiar interest in the wealthy and glamorous Parks for their livelihood until they get entangled in an unexpected incident.",2019-05-30,64.791,8.5,13873
11,724089,Gabriel's Inferno: Part II,"Professor Gabriel Emerson finally learns the truth about Julia Mitchell's identity, but his realization comes a moment too late. Julia is done waiting for the well-respected Dante specialist to remember her and wants nothing more to do with him. Can Gabriel win back her heart before she finds love in another's arms?",2020-07-31,23.002,8.5,1414
12,533514,Violet Evergarden: The Movie,"As the world moves on from the war and technological advances bring changes to her life, Violet still hopes to see her lost commanding officer again.",2020-09-18,22.373,8.5,237
13,389,12 Angry Men,"The defense and the prosecution have rested and the jury is filing into the jury room to decide if a young Spanish-American is guilty or innocent of murdering his father. What begins as an open and shut case soon becomes a mini-drama of each of the jurors' prejudices and preconceptions about the trial, the accused, and each other.",1957-04-10,21.686,8.5,6476
14,497,The Green Mile,"A supernatural tale set on death row in a Southern prison, where gentle giant John Coffey possesses the mysterious power to heal people's ailments. When the cell block's head guard, Paul Edgecomb, recognizes Coffey's miraculous gift, he tries desperately to help stave off the condemned man's execution.",1999-12-10,132.481,8.5,14043
15,730154,Your Eyes Tell,"A tragic accident lead to Kaori's blindness, but she clings to life and the smaller pleasures it can still afford her. She meets Rui and begins to talk to him. Rui was once a promising kickboxer, but something happened in his past. Kaori's smile brings out a change in Rui. However, the two are connected in more than one way. Rui attempts to do what is right.",2020-10-23,54.208,8.5,323
16,761053,Gabriel's Inferno: Part III,The final part of the film adaption of the erotic romance novel Gabriel's Inferno written by an anonymous Canadian author under the pen name Sylvain Reynard.,2020-11-19,51.527,8.5,966
17,155,The Dark Knight,"Batman raises the stakes in his war on crime. With the help of Lt. Jim Gordon and District Attorney Harvey Dent, Batman sets out to dismantle the remaining criminal organizations that plague the streets. The partnership proves to be effective, but they soon find themselves prey to a reign of chaos unleashed by a rising criminal mastermind known to the terrified citizens of Gotham as the Joker.",2008-07-14,74.459,8.5,27748
18,680,Pulp Fiction,"A burger-loving hit man, his philosophical partner, a drug-addled gangster's moll and a washed-up boxer converge in this sprawling, comedic crime caper. Their adventures unfurl in three stories that ingeniously trip back and forth in time.",1994-09-10,60.588,8.5,23317
19,429,"The Good, the Bad and the Ugly","While the Civil War rages between the Union and the Confederacy, three men – a quiet loner, a ruthless hit man and a Mexican bandit – comb the American Southwest in search of a strongbox containing $200,000 in stolen gold.",1966-12-23,31.986,8.5,6682
20,122,The Lord of the Rings: The Return of the King,"Aragorn is revealed as the heir to the ancient kings as he, Gandalf and the other members of the broken fellowship struggle to save Gondor from Sauron's forces. Meanwhile, Frodo and Sam take the ring closer to the heart of Mordor, the dark lord's realm.",2003-12-01,111.025,8.5,19672
21,13,Forrest Gump,"A man with a low IQ has accomplished great things in his life and been present during significant historic events—in each case, far exceeding what anyone imagined he could do. But despite all he has achieved, his one true love eludes him.",1994-06-23,68.802,8.5,22858
22,11216,Cinema Paradiso,"A filmmaker recalls his childhood, when he fell in love with the movies at his village's theater and formed a deep friendship with the theater's projectionist.",1988-11-17,19.304,8.5,3366
23,346,Seven Samurai,"A samurai answers a village's request for protection after he falls on hard times. The town needs protection from bandits, so the samurai gathers six others to help him teach the people how to defend themselves, and the villagers provide the soldiers with food.",1954-04-26,18.96,8.5,2694
24,652837,"Josee, the Tiger and the Fish","With dreams of diving abroad, Tsuneo gets a job assisting Josee, an artist whose imagination takes her far beyond her wheelchair. But when the tide turns against them, they push each other to places they never thought possible, and inspire a love fit for a storybook.",2020-12-25,14.009,8.5,237
25,769,GoodFellas,"The true story of Henry Hill, a half-Irish, half-Sicilian Brooklyn kid who is adopted by neighbourhood gangsters at an early age and climbs the ranks of a Mafia family under the guidance of Jimmy Conway.",1990-09-12,38.606,8.5,10186
26,637,Life Is Beautiful,A touching story of an Italian book seller of Jewish ancestry who lives in his own little fairy tale. His creative and happy life would come to an abrupt halt when his entire family is deported to a concentration camp during World War II. While locked up he tries to convince his son that the whole thing is just a game.,1997-12-20,52.997,8.5,11112
27,311,Once Upon a Time in America,"A former Prohibition-era Jewish gangster returns to the Lower East Side of Manhattan over thirty years later, where he once again must confront the ghosts and regrets of his old life.",1984-05-23,24.573,8.4,4207
28,40096,A Dog's Will,"The lively Jack the Cricket and the sly Chicó are poor guys living in the hinterland who cheat a bunch of people in a small in Northeastern Brazil. When they die, they have to be judged by Christ, the Devil and the Virgin Mary before they are admitted to paradise.",2000-09-15,7.061,8.4,892
29,14537,Harakiri,"Down-on-his-luck veteran Tsugumo Hanshirō enters the courtyard of the prosperous House of Iyi. Unemployed, and with no family, he hopes to find a place to commit seppuku—and a worthy second to deliver the coup de grâce in his suicide ritual. The senior counselor for the Iyi clan questions the ronin’s resolve and integrity, suspecting Hanshirō of seeking charity rather than an honorable end. What follows is a pair of interlocking stories which lay bare the difference between honor and respect, and promises to examine the legendary foundations of the Samurai code.",1962-09-15,11.848,8.4,639
30,539,Psycho,"When larcenous real estate clerk Marion Crane goes on the lam with a wad of cash and hopes of starting a new life, she ends up at the notorious Bates Motel, where manager Norman Bates cares for his housebound mother.",1960-06-22,32.663,8.4,8225
31,12477,Grave of the Fireflies,"In the final months of World War II, 14-year-old Seita and his sister Setsuko are orphaned when their mother is killed during an air raid in Kobe, Japan. After a falling out with their aunt, they move into an abandoned bomb shelter. With no surviving relatives and their emergency rations depleted, Seita and Setsuko struggle to survive.",1988-04-16,0.6,8.4,4160
32,510,One Flew Over the Cuckoo's Nest,"While serving time for insanity at a state mental hospital, implacable rabble-rouser, Randle Patrick McMurphy, inspires his fellow patients to rebel against the authoritarian rule of head nurse, Mildred Ratched.",1975-11-18,24.141,8.4,8639
33,550,Fight Club,"A ticking-time-bomb insomniac and a slippery soap salesman channel primal male aggression into a shocking new form of therapy. Their concept catches on, with underground ""fight clubs"" forming in every town, until an eccentric gets in the way and ignites an out-of-control spiral toward oblivion.",1999-10-15,57.067,8.4,24265
34,283566,Evangelion: 3.0+1.0 Thrice Upon a Time,"In the aftermath of the Fourth Impact, stranded without their Evangelions, Shinji, Asuka, and Rei find refuge in one of the rare pockets of humanity that still exist on the ruined planet Earth. There, each of them live a life far different from their days as an Evangelion pilot. However, the danger to the world is far from over. A new impact is looming on the horizon—one that will prove to be the true end of Evangelion.",2021-03-08,120.65,8.4,514
35,378064,A Silent Voice: The Movie,"Shouya Ishida starts bullying the new girl in class, Shouko Nishimiya, because she is deaf. But as the teasing continues, the rest of the class starts to turn on Shouya for his lack of compassion. When they leave elementary school, Shouko and Shouya do not speak to each other again... until an older, wiser Shouya, tormented by his past behaviour, decides he must see Shouko once more. He wants to atone for his sins, but is it already too late...?",2016-09-17,127.715,8.4,2982
36,324857,Spider-Man: Into the Spider-Verse,"Miles Morales is juggling his life between being a high school student and being a spider-man. When Wilson ""Kingpin"" Fisk uses a super collider, others from across the Spider-Verse are transported to this dimension.",2018-12-06,110.343,8.4,11400
37,598,City of God,"Buscapé was raised in a very violent environment. Despite the feeling that all odds were against him, he finds out that life can be seen with other eyes...",2002-02-05,43.186,8.4,5826
38,92321,Hotarubi no Mori e,"One hot summer day a little girl gets lost in an enchanted forest of the mountain god where spirits reside. A young boy appears before her, but she cannot touch him for fear of making him disappear. And so a wondrous adventure awaits...",2011-09-17,0.6,8.4,794
39,255709,Hope,"After 8-year-old So-won narrowly survives a brutal sexual assault, her family labors to help her heal while coping with their own rage and grief.",2013-10-02,17.206,8.4,390
40,4935,Howl's Moving Castle,"When Sophie, a shy young woman, is cursed with an old body by a spiteful witch, her only chance of breaking the spell lies with a self-indulgent yet insecure young wizard and his companions in his legged, walking castle.",2004-11-19,79.86,8.4,7376
41,1891,The Empire Strikes Back,"The epic saga continues as Luke Skywalker, in hopes of defeating the evil Galactic Empire, learns the ways of the Jedi from aging master Yoda. But Darth Vader is more determined than ever to capture Luke. Meanwhile, rebel leader Princess Leia, cocky Han Solo, Chewbacca, and droids C-3PO and R2-D2 are thrown into various stages of capture, betrayal and despair.",1980-05-20,38.419,8.4,14257
42,18491,Neon Genesis Evangelion: The End of Evangelion,"The second of two theatrically released follow-ups to the Neon Genesis Evangelion series. Comprising of two alternate episodes which were first intended to take the place of episodes 25 and 26, this finale answers many of the questions surrounding the series, while also opening up some new possibilities.",1997-07-19,38.04,8.4,1082
43,599,Sunset Boulevard,A hack screenwriter writes a screenplay for a former silent film star who has faded into Hollywood obscurity.,1950-08-10,14.611,8.4,1964
44,120,The Lord of the Rings: The Fellowship of the Ring,"Young hobbit Frodo Baggins, after inheriting a mysterious ring from his uncle Bilbo, must leave his home in order to keep it from falling into the hands of its evil creator. Along the way, a fellowship is formed to protect the ringbearer and make sure that the ring arrives at its final destination: Mt. Doom, the only place where it can be destroyed.",2001-12-18,114.382,8.4,21070
45,441130,Wolfwalkers,"In a time of superstition and magic, when wolves are seen as demonic and nature an evil to be tamed, a young apprentice hunter comes to Ireland with her father to wipe out the last pack. But when she saves a wild native girl, their friendship leads her to discover the world of the Wolfwalkers and transform her into the very thing her father is tasked to destroy.",2020-10-26,19.696,8.4,785
46,704264,Primal: Tales of Savagery,"Genndy Tartakovsky's Primal: Tales of Savagery features a caveman and a dinosaur on the brink of extinction. Bonded by tragedy, this unlikely friendship becomes the only hope of survival.",2019-11-21,23.873,8.4,222
47,423,The Pianist,"The true story of pianist Władysław Szpilman's experiences in Warsaw during the Nazi occupation. When the Jews of the city find themselves forced into a ghetto, Szpilman finds work playing in a café; and when his family is deported in 1942, he stays behind, works for a while as a laborer, and eventually goes into hiding in the ruins of the war-torn city.",2002-09-17,40.797,8.4,7318
48,244786,Whiplash,"Under the direction of a ruthless instructor, a talented young drummer begins to pursue perfection at any cost, even his humanity.",2014-10-10,61.409,8.4,12275
49,157336,Interstellar,The adventures of a group of explorers who make use of a newly discovered wormhole to surpass the limitations on human space travel and conquer the vast distances involved in an interstellar voyage.,2014-11-05,184.578,8.4,28688
50,73,American History X,"Derek Vineyard is paroled after serving 3 years in prison for killing two African-American men. Through his brother, Danny Vineyard's narration, we learn that before going to prison, Derek was a skinhead and the leader of a violent white supremacist gang that committed acts of racial crime throughout L.A. and his actions greatly influenced Danny. Reformed and fresh out of prison, Derek severs contact with the gang and becomes determined to keep Danny from going down the same violent path as he did.",1998-07-01,27.948,8.4,9636
51,3782,Ikiru,"Kanji Watanabe is a middle-aged man who has worked in the same monotonous bureaucratic position for decades. Learning he has cancer, he starts to look for the meaning of his life.",1952-10-09,9.486,8.4,794
52,635302,Demon Slayer -Kimetsu no Yaiba- The Movie: Mugen Train,"Tanjirō Kamado, joined with Inosuke Hashibira, a boy raised by boars who wears a boar's head, and Zenitsu Agatsuma, a scared boy who reveals his true power when he sleeps, boards the Infinity Train on a new mission with the Fire Hashira, Kyōjurō Rengoku, to defeat a demon who has been tormenting the people and killing the demon slayers who oppose it!",2020-10-16,911.596,8.4,2488
53,121,The Lord of the Rings: The Two Towers,"Frodo and Sam are trekking to Mordor to destroy the One Ring of Power while Gimli, Legolas and Aragorn search for the orc-captured Merry and Pippin. All along, nefarious wizard Saruman awaits the Fellowship members at the Orthanc Tower in Isengard.",2002-12-18,101.634,8.4,18238
54,567,Rear Window,A wheelchair-bound photographer spies on his neighbors from his apartment window and becomes convinced one of them has committed murder.,1954-08-01,19.128,8.4,5188
55,12493,High and Low,An executive of a shoe company becomes a victim of extortion when his chauffeur's son is kidnapped and held for ransom.,1963-03-01,8.727,8.4,593
56,632632,Given,"The film centers on the love relationship among the band's bassist Haruki Nakayama, drummer Akihiko Kaji, and Akihiko's roommate and ex-boyfriend Ugetsu Murata.",2020-08-22,123.779,8.4,320
57,901,City Lights,"In this sound-era silent film, a tramp falls in love with a beautiful blind flower seller.",1931-02-01,9.0,8.4,1638
58,914,The Great Dictator,Dictator Adenoid Hynkel tries to expand his empire while a poor Jewish barber tries to avoid persecution from Hynkel's regime.,1940-10-15,16.225,8.4,2632
59,27205,Inception,"Cobb, a skilled thief who commits corporate espionage by infiltrating the subconscious of his targets is offered a chance to regain his old life as payment for a task considered to be impossible: ""inception"", the implantation of another person's idea into a target's subconscious.",2010-07-15,113.857,8.4,31729
60,807,Se7en,"Two homicide detectives are on a desperate hunt for a serial killer whose crimes are based on the ""seven deadly sins"" in this dark and haunting film that takes viewers from the tortured remains of one victim to the next. The seasoned Det. Sommerset researches each sin in an effort to get inside the killer's mind, while his novice partner, Mills, scoffs at his efforts to unravel the case.",1995-09-22,58.04,8.4,17197
61,644479,Dedicated to my ex,"The film tells the story of Ariel, a 21-year-old who decides to form a rock band to compete for a prize of ten thousand dollars in a musical band contest, this as a last option when trying to get money to save their relationship and reunite with his ex-girlfriend, which breaks due to the trip she must make to Finland for an internship. Ariel with her friend Ortega, decides to make a casting to find the other members of the band, although they do not know nothing about music, thus forming a band with members that have diverse and opposite personalities.",2019-11-01,11.593,8.3,473
62,128,Princess Mononoke,"Ashitaka, a prince of the disappearing Emishi people, is cursed by a demonized boar god and must journey to the west to find a cure. Along the way, he encounters San, a young human woman fighting to protect the forest, and Lady Eboshi, who is trying to destroy it. Ashitaka must find a way to bring balance to this conflict.",1997-07-12,35.874,8.3,6330
63,25237,Come and See,"The invasion of a village in Byelorussia by German forces sends young Florya into the forest to join the weary Resistance fighters, against his family's wishes. There he meets a girl, Glasha, who accompanies him back to his village. On returning home, Florya finds his family and fellow peasants massacred. His continued survival amidst the brutal debris of war becomes increasingly nightmarish, a battle between despair and hope.",1985-07-09,15.081,8.3,948
64,274,The Silence of the Lambs,"Clarice Starling is a top student at the FBI's training academy. Jack Crawford wants Clarice to interview Dr. Hannibal Lecter, a brilliant psychiatrist who is also a violent psychopath, serving life behind bars for various acts of murder and cannibalism. Crawford believes that Lecter may have insight into a case and that Starling, as an attractive young woman, may be just the bait to draw him out.",1991-02-01,10.395,8.3,13378
65,545611,Everything Everywhere All at Once,"An aging Chinese immigrant is swept up in an insane adventure, where she alone can save what's important to her by connecting with the lives she could have led in other universes.",2022-03-24,260.169,8.3,707
66,361743,Top Gun: Maverick,"After more than thirty years of service as one of the Navy’s top aviators, and dodging the advancement in rank that would ground him, Pete “Maverick” Mitchell finds himself training a detachment of TOP GUN graduates for a specialized mission the likes of which no living pilot has ever seen.",2022-05-24,1107.967,8.3,1177
67,592350,My Hero Academia: Heroes Rising,"Class 1-A visits Nabu Island where they finally get to do some real hero work. The place is so peaceful that it's more like a vacation … until they're attacked by a villain with an unfathomable Quirk! His power is eerily familiar, and it looks like Shigaraki had a hand in the plan. But with All Might retired and citizens' lives on the line, there's no time for questions. Deku and his friends are the next generation of heroes, and they're the island's only hope.",2019-12-20,226.425,8.3,928
68,3082,Modern Times,The Tramp struggles to live in modern industrial society with the help of a young homeless woman.,1936-02-05,12.749,8.3,2966
69,556574,Hamilton,"Presenting the tale of American founding father Alexander Hamilton, this filmed version of the original Broadway smash hit is the story of America then, told by America now.",2020-07-03,13.546,8.3,971
70,207,Dead Poets Society,"At an elite, old-fashioned boarding school in New England, a passionate English teacher inspires his students to rebel against convention and seize the potential of every day, courting the disdain of the stern headmaster.",1989-06-02,24.153,8.3,9173
71,630566,Clouds,"Young musician Zach Sobiech discovers his cancer has spread, leaving him just a few months to live. With limited time, he follows his dream and makes an album, unaware that it will soon be a viral music phenomenon.",2020-10-09,21.477,8.3,846
72,527641,Five Feet Apart,"Seventeen-year-old Stella spends most of her time in the hospital as a cystic fibrosis patient. Her life is full of routines, boundaries and self-control — all of which get put to the test when she meets Will, an impossibly charming teen who has the same illness. There's an instant flirtation, though restrictions dictate that they must maintain a safe distance between them. As their connection intensifies, so does the temptation to throw the rules out the window and embrace that attraction.",2019-03-14,85.104,8.3,4784
73,101,Léon: The Professional,"Léon, the top hit man in New York, has earned a rep as an effective ""cleaner"". But when his next-door neighbors are wiped out by a loose-cannon DEA agent, he becomes the unwilling custodian of 12-year-old Mathilda. Before long, Mathilda's thoughts turn to revenge, and she considers following in Léon's footsteps.",1994-09-14,53.212,8.3,12163
74,618344,Justice League Dark: Apokolips War,"Earth is decimated after intergalactic tyrant Darkseid has devastated the Justice League in a poorly executed war by the DC Super Heroes. Now the remaining bastions of good – the Justice League, Teen Titans, Suicide Squad and assorted others – must regroup, strategize and take the war to Darkseid in order to save the planet and its surviving inhabitants.",2020-05-05,35.211,8.3,1177
75,975,Paths of Glory,A commanding officer defends three scapegoats on trial for a failed offensive that occurred within the French Army in 1916.,1957-10-25,12.995,8.3,2206
76,335,Once Upon a Time in the West,"As the railroad builders advance unstoppably through the Arizona desert on their way to the sea, Jill arrives in the small town of Flagstone with the intention of starting a new life.",1968-12-21,19.091,8.3,3405
77,42269,We All Loved Each Other So Much,"Three partisans bound by a strong friendship return home after the war, but the clash with everyday reality puts a strain on their bond.",1974-12-21,7.342,8.3,421
78,572154,Rascal Does Not Dream of a Dreaming Girl,"In Fujisawa, Sakuta Azusagawa is in his second year of high school. Blissful days with his girlfriend and upperclassman, Mai Sakurajima, are interrupted by the appearance of his first crush, Shoko Makinohara.",2019-06-15,97.891,8.3,383
