,id,title,overview,release_date,popularity,vote_average,vote_count
826,143,All Quiet on the Western Front,"A young soldier faces profound disillusionment in the soul-destroying horror of World War I. Together with several other young German soldiers, he experiences the horrors of war, such evil of which he had not conceived of when signing up to fight. They eventually become sad, tormented, and confused of their purpose.",1930-04-29,10.18,7.8,535
827,539517,Constantine: City of Demons - The Movie,"A decade after a tragic mistake, family man Chas and occult detective John Constantine set out to cure Chas’s daughter Trish from a mysterious supernatural coma. With the help of the mysterious Nightmare Nurse, the influential Queen of Angels, and brutal Aztec God Mictlantecuhtli, the pair just might have a chance at outsmarting the demon Beroul to save Trish’s soul. In a world of shadows and dark magic, not everything is what it seems, and there’s always a price to pay. The path to redemption is never easy, and if Constantine is to succeed, he must navigate through the dark urban underbelly of Los Angeles, outwit the most cunning spawns of hell, and come face to face with arch-nemesis Nergal – all while battling his own inner demons!",2018-10-04,33.526,7.8,441
828,375794,No Manches Frida,"After his release from prison, bank robber Zequi sets off to recover the stolen money that was buried by his dizzy accomplice. He's horrified to learn that a high school gymnasium is now standing over the site where the loot is stashed. Needing to infiltrate the building, Zequi lands a job as a substitute teacher for a group of wild and unruly students. As the ex-con tries to lay down the law, he starts to realize that life in jail may have been easier than trying to deal with rebellious teens.",2016-09-02,83.629,7.8,649
829,15916,Angel's Egg,"A mysterious young girl wanders a desolate, otherworldly landscape, carrying a large egg.",1985-12-22,8.44,7.8,274
830,303,Notorious,"In order to help bring Nazis to justice, U.S. government agent T.R. Devlin recruits Alicia Huberman, the American daughter of a convicted German war criminal, as a spy. As they begin to fall for one another, Alicia is instructed to win the affections of Alexander Sebastian, a Nazi hiding out in Brazil. When Sebastian becomes serious about his relationship with Alicia, the stakes get higher, and Devlin must watch her slip further undercover.",1946-08-21,12.03,7.8,1211
831,262,The King of Comedy,"Aspiring comic Rupert Pupkin attempts to achieve success in show business by stalking his idol, a late night talk-show host who craves his own privacy.",1983-02-18,10.941,7.8,1719
832,583083,The Kissing Booth 2,"With college decisions looming, Elle juggles her long-distance romance with Noah, changing relationship with bestie Lee and feelings for a new classmate.",2020-07-24,54.157,7.8,4510
833,925,Do the Right Thing,"Salvatore ""Sal"" Fragione is the Italian owner of a pizzeria in Brooklyn. A neighborhood local, Buggin' Out, becomes upset when he sees that the pizzeria's Wall of Fame exhibits only Italian actors. Buggin' Out believes a pizzeria in a black neighborhood should showcase black actors, but Sal disagrees. The wall becomes a symbol of racism and hate to Buggin' Out and to other people in the neighborhood, and tensions rise.",1989-06-14,8.272,7.8,1320
834,52345,Lisbela and the Prisoner,"Lisbela is a young woman who loves going to the movies. Leléu is a con man, going from town to town selling all sort of things and performing as master of ceremonies for some cheesy numbers, such as the woman who gets transformed into a gorilla. He gets involved with Linaura, a sexy and beautiful woman who happens to be the wife of the most frightening hitman of the place. The hitman finds out his wife's affair and goes after Leléu, who has to leave in a hurry. In another town, he meets and falls instantly in love with Lisbela, who is engaged to Douglas, a hillbilly who tries hard to pass for a cosmopolitan Rio de Janeiro dweller.",2003-08-22,1.181,7.8,336
835,20126,Deep Red,"A musician witnesses the murder of a famous psychic, and then teams up with a fiesty reporter to find the killer while evading attempts on their lives by the unseen killer bent on keeping a dark secret buried.",1975-03-07,7.567,7.8,1130
836,107,Snatch,"Unscrupulous boxing promoters, violent bookmakers, a Russian gangster, incompetent amateur robbers and supposedly Jewish jewelers fight to track down a priceless stolen diamond.",2000-09-01,16.697,7.8,7389
837,126319,Ernest & Celestine,"Celestine is a little mouse trying to avoid a dental career while Ernest is a big bear craving an artistic outlet. When Celestine meets Ernest, they overcome their natural enmity by forging a life of crime together.",2012-12-12,8.649,7.8,464
838,141,Donnie Darko,"After narrowly escaping a bizarre accident, a troubled teenager is plagued by visions of a large bunny rabbit that manipulates him to commit a series of crimes.",2001-10-24,26.289,7.8,10454
839,599521,Z-O-M-B-I-E-S 2,"Zed and Addison are back at Seabrook High, where, after a groundbreaking semester, they continue to steer both their school and community toward unity. But the arrival of a new group of outsiders – mysterious werewolves – threatens to shake up the newfound peace and causes a rift in Zed and Addison’s budding romance.",2020-06-13,29.792,7.8,312
840,359784,Maudie,Canadian folk artist Maud Lewis falls in love with a fishmonger while working for him as a live-in housekeeper.,2016-06-16,9.31,7.8,338
841,317182,Doctor Who: Last Christmas,"The Doctor and Clara face their Last Christmas. Trapped on an Arctic base, under attack from terrifying creatures, who are you going to call? Santa Claus!",2014-12-25,7.103,7.8,205
842,22504,The King and the Mockingbird,"The kingdom of Takicardie quakes under the rule of the tyrannical King Charles V-et-III-font-VIII-et-VIII-font-XVI, whose favourite pastime is shooting birds. His archenemy is a cheeky mockingbird, whose favourite pastime is thwarting the king’s attempts to shoot birds. One night, a portrait of the king comes to life and disposes of the real king, taking his place. The portrait king falls in love with a young shepherdess in another painting and intends to marry her. But, alas, the shepherdess has fallen in love with a chimneysweep and together they elope from the king’s palace. Enraged, the king sends his police to capture them and once they are within his power he forces the shepherdess to marry him. The mockingbird must use all his guile and courage to once more thwart the king and bring his evil reign to an end.",1980-03-19,5.387,7.8,297
843,10193,Toy Story 3,"Woody, Buzz, and the rest of Andy's toys haven't been played with in years. With Andy about to go to college, the gang find themselves accidentally left at a nefarious day care center. The toys must band together to escape and return home to Andy.",2010-06-16,141.447,7.8,12569
844,10191,How to Train Your Dragon,"As the son of a Viking leader on the cusp of manhood, shy Hiccup Horrendous Haddock III faces a rite of passage: he must kill a dragon to prove his warrior mettle. But after downing a feared dragon, he realizes that he no longer wants to destroy it, and instead befriends the beast – which he names Toothless – much to the chagrin of his warrior father.",2010-03-18,77.282,7.8,10991
845,435366,Fabricated City,"In real life, Kwon Yoo is unemployed, but in the virtual game world he is the best leader. Kwon Yoo is then framed for a murder. With the help of hacker Yeo-Wool, he tries to uncover the truth behind the murder case.",2017-02-09,18.363,7.8,252
846,277216,Straight Outta Compton,"In 1987, five young men, using brutally honest rhymes and hardcore beats, put their frustration and anger about life in the most dangerous place in America into the most powerful weapon they had: their music.  Taking us back to where it all began, Straight Outta Compton tells the true story of how these cultural rebels—armed only with their lyrics, swagger, bravado and raw talent—stood up to the authorities that meant to keep them down and formed the world’s most dangerous group, N.W.A.  And as they spoke the truth that no one had before and exposed life in the hood, their voice ignited a social revolution that is still reverberating today.",2015-08-11,53.039,7.8,3213
847,149870,The Wind Rises,"A lifelong love of flight inspires Japanese aviation engineer Jiro Horikoshi, whose storied career includes the creation of the A-6M World War II fighter plane.",2013-07-20,29.606,7.8,2261
848,336804,Mustang,"In a Turkish village, five orphaned sisters live under strict rule while members of their family prepare their arranged marriages.",2015-06-17,8.311,7.8,1185
849,1480,Touch of Evil,"When a car bomb explodes on the American side of the U.S./Mexico border, Mexican drug enforcement agent Miguel Vargas begins his investigation, along with American police captain Hank Quinlan. When Vargas begins to suspect that Quinlan and his shady partner, Menzies, are planting evidence to frame an innocent man, his investigations into their possible corruption quickly put himself and his new bride, Susie, in jeopardy.",1958-03-30,11.645,7.8,1124
850,537116,"tick, tick... BOOM!","On the cusp of his 30th birthday, Jonathon Larson, a promising young theater composer, navigates love, friendship, and the pressures of life as an artist in New York City.",2021-11-11,30.476,7.8,1411
851,234200,Pride,"Set in the summer of 1984 – Margaret Thatcher is in power and the National Union of Mineworkers (NUM) is on strike. At the Gay Pride March in London, a group of gay and lesbian activists decides to raise money to support the families of the striking miners. So they created the LGSM (Lesbian, Gays, Support the Miners) but there is a problem. The Union seems embarrassed to receive their support.",2014-09-12,10.895,7.8,1086
852,10227,PlayTime,"Clumsy Monsieur Hulot finds himself perplexed by the intimidating complexity of a gadget-filled Paris. He attempts to meet with a business contact but soon becomes lost. His roundabout journey parallels that of an American tourist, and as they weave through the inventive urban environment, they intermittently meet, developing an interest in one another. They eventually get together at a chaotic restaurant, along with several other quirky characters.",1967-12-16,8.4,7.8,403
853,873,The Color Purple,"An epic tale spanning forty years in the life of Celie, an African-American woman living in the South who survives incredible abuse and bigotry. After Celie's abusive father marries her off to the equally debasing 'Mister' Albert Johnson, things go from bad to worse, leaving Celie to find companionship anywhere she can. She perseveres, holding on to her dream of one day being reunited with her sister in Africa.",1985-12-18,11.729,7.8,1335
854,672322,Rurouni Kenshin: The Beginning,"Before he was a protector, Kenshin was a fearsome assassin known as Battosai. But when he meets gentle Tomoe Yukishiro, a beautiful young woman who carries a huge burden in her heart, his life will change forever.",2021-06-04,129.205,7.8,280
855,629542,The Bad Guys,"When the infamous Bad Guys are finally caught after years of countless heists and being the world’s most-wanted villains, Mr. Wolf brokers a deal to save them all from prison.",2022-03-17,1151.482,7.8,677
856,49687,Marriage Italian Style,"When Domenico first meets Filomena in Naples during World War II, he is instantly smitten. Flash forward to the postwar years, and the two meet again, sparking a passionate affair that spans two decades. But when Filomena — who has now become Domenico's kept woman and has secretly borne his children — learns that her lover is planning to wed another, she will stop at nothing to hook him into marrying her instead.",1964-12-18,6.805,7.8,401
857,13042,Presto,"Dignity. Poise. Mystery. We expect nothing less from the great turn-of-the-century magician, Presto. But when Presto neglects to feed his rabbit one too many times, the magician finds he isn't the only one with a few tricks up his sleeve!",2008-06-27,8.108,7.8,816
858,28145,"They Shoot Horses, Don't They?","In the midst of the Great Depression, manipulative emcee Rocky enlists contestants for a dance marathon offering a $1,500 cash prize. Among them are a failed actress, a middle-aged sailor, a delusional blonde and a pregnant girl.",1969-12-10,6.399,7.8,225
859,11697,The Man Who Shot Liberty Valance,"A senator, who became famous for killing a notorious outlaw, returns for the funeral of an old friend and tells the truth about his deed.",1962-04-15,12.175,7.8,835
860,851,Brief Encounter,"Returning home from a shopping trip to a nearby town, bored suburban housewife Laura Jesson is thrown by happenstance into an acquaintance with virtuous doctor Alec Harvey. Their casual friendship soon develops during their weekly visits into something more emotionally fulfilling than either expected, and they must wrestle with the potential havoc their deepening relationship would have on their lives and the lives of those they love.",1945-11-24,7.944,7.8,440
861,40662,Batman: Under the Red Hood,"One part vigilante, one part criminal kingpin, Red Hood begins cleaning up Gotham with the efficiency of Batman, but without following the same ethical code.",2010-07-27,27.49,7.8,1273
862,14836,Coraline,"When Coraline moves to an old house, she feels bored and neglected by her parents. She finds a hidden door with a bricked up passage. During the night, she crosses the passage and finds a parallel world where everybody has buttons instead of eyes, with caring parents and all her dreams coming true. When the Other Mother invites Coraline to stay in her world forever, the girl refuses and finds that the alternate reality where she is trapped is only a trick to lure her.",2009-02-05,211.606,7.8,5830
863,553,Dogville,"A barren soundstage is stylishly utilized to create a minimalist small-town setting in which a mysterious woman named Grace hides from the criminals who pursue her. The town is two-faced and offers to harbor Grace as long as she can make it worth their effort, so Grace works hard under the employ of various townspeople to win their favor. Tensions flare, however, and Grace's status as a helpless outsider provokes vicious contempt and abuse from the citizens of Dogville.",2003-05-19,14.424,7.8,1939
864,498249,Bad Seeds,"Wael, a former street child, makes a living from small scams with his adoptive mother and partner-in-crime Monique. When this unconventional duo swindles the wrong guy, Victor, an old acquaintance of Monique now in charge of a support organization for troubled teens, they have no choice but to become his interim secretary and educator in order to redeem themselves.",2018-11-21,8.292,7.8,486
865,169813,Short Term 12,"Grace, a compassionate young supervisor at a foster care facility, helps at-risk teens. But when a new charge dredges up memories of her own troubled past, Grace's tough exterior begins eroding.",2013-08-23,8.354,7.8,1061
866,703,Annie Hall,New York comedian Alvy Singer falls in love with the ditsy Annie Hall.,1977-04-19,13.512,7.8,3214
867,29458,One Hundred Steps,"The true story of Peppino Impastato, an activist who openly opposed the Mafia in small-town 1970s Sicily despite living just ""one hundred steps"" away from notorious Mafia boss Tano Badalamenti.",2000-09-01,7.41,7.8,553
868,27670,Nothing Left to Do but Cry,"A teacher (Saverio) and a schoolkeeper (Mario) get lost in the Italian countryside. They find themselves in the late 15th century, they met Leonardo da Vinci and try to teach him how to play cards, they try to stop Columbus, they sing beatles's song etc...",1984-12-20,5.703,7.8,932
869,16052,Selena,"In this biographical drama, Selena Quintanilla is born into a musical Mexican-American family in Texas. Her father, Abraham, realizes that his young daughter is talented and begins performing with her at small venues. She finds success and falls for her guitarist, Chris Perez, who draws the ire of her father. Seeking mainstream stardom, Selena begins recording an English-language album which, tragically, she would never complete.",1997-03-21,32.585,7.8,1011
870,4977,Paprika,"When a machine that allows therapists to enter their patient's dreams is stolen, all hell breaks loose. Only a young female therapist can stop it: Paprika.",2006-10-01,18.512,7.8,1686
871,84892,The Perks of Being a Wallflower,"Pittsburgh, Pennsylvania, 1991. High school freshman Charlie is a wallflower, always watching life from the sidelines, until two senior students, Sam and her stepbrother Patrick, become his mentors, helping him discover the joys of friendship, music and love.",2012-09-20,31.37,7.8,9003
872,49797,I Saw the Devil,"Kyung-Chul is a dangerous psychopath who kills for pleasure. Soo-Hyun, a top-secret agent, decides to track down the murderer himself. He promises himself that he will do everything in his power to take vengeance against the killer, even if it means that he must become a monster himself.",2010-08-12,15.344,7.8,1871
873,5961,Fanny and Alexander,"As children in the loving Ekdahl family, Fanny and Alexander enjoy a happy life with their parents, who run a theater company. After their father dies unexpectedly, however, the siblings end up in a joyless home when their mother, Emilie, marries a stern bishop. The bleak situation gradually grows worse as the bishop becomes more controlling, but dedicated relatives make a valiant attempt to aid Emilie, Fanny and Alexander.",1982-12-17,6.549,7.8,585
874,27040,Meshes of the Afternoon,"A woman returning home falls asleep and has vivid dreams that may or may not be happening in reality. Through repetitive images and complete mismatching of the objective view of time and space, her dark inner desires play out on-screen.",1943-01-01,5.316,7.8,266
875,12496,The Twilight Samurai,"Seibei Iguchi leads a difficult life as a low ranking samurai at the turn of the nineteenth century. A widower with a meager income, Seibei struggles to take care of his two daughters and senile mother. New prospects seem to open up when the beautiful Tomoe, a childhood friend, comes back into he and his daughters' life, but as the Japanese feudal system unravels, Seibei is still bound by the code of honor of the samurai and by his own sense of social precedence. How can he find a way to do what is best for those he loves?",2002-11-02,7.89,7.8,230
876,12444,Harry Potter and the Deathly Hallows: Part 1,"Harry, Ron and Hermione walk away from their last year at Hogwarts to find and destroy the remaining Horcruxes, putting an end to Voldemort's bid for immortality. But with Harry's beloved Dumbledore dead and Voldemort's unscrupulous Death Eaters on the loose, the world is more dangerous than ever.",2010-10-17,217.967,7.8,16109
877,2118,L.A. Confidential,Three detectives in the corrupt and brutal L.A. police force of the 1950s use differing methods to uncover a conspiracy behind the shotgun slayings of the patrons at an all-night diner.,1997-09-19,18.511,7.8,3883
878,13855,The Chaser,"Joong-ho is a dirty detective turned pimp in financial trouble as several of his girls have recently disappeared without clearing their debts. While trying to track them down, he finds a clue that the vanished girls were all called up by the same client whom one of his girls is meeting with right now.",2008-02-14,10.378,7.8,949
879,713776,If Anything Happens I Love You,Grieving parents journey through an emotional void as they mourn the loss of a child in the aftermath of a tragic school shooting.,2020-03-07,5.884,7.8,662
880,508439,Onward,"In a suburban fantasy world, two teenage elf brothers embark on an extraordinary quest to discover if there is still a little magic left out there.",2020-02-29,47.671,7.8,5053
881,166428,How to Train Your Dragon: The Hidden World,"As Hiccup fulfills his dream of creating a peaceful dragon utopia, Toothless’ discovery of an untamed, elusive mate draws the Night Fury away. When danger mounts at home and Hiccup’s reign as village chief is tested, both dragon and rider must make impossible decisions to save their kind.",2019-01-03,104.414,7.8,5175
882,28162,A Matter of Life and Death,"When a young airman miraculously survives bailing out of his aeroplane without a parachute, he falls in love with an American radio operator. But the officials in the other world realise their mistake, and dispatch an angel to collect him.",1946-12-15,6.344,7.8,274
883,2062,Ratatouille,"Remy, a resident of Paris, appreciates good food and has quite a sophisticated palate. He would love to become a chef so he can create and enjoy culinary masterpieces to his heart's delight. The only problem is, Remy is a rat. When he winds up in the sewer beneath one of Paris' finest restaurants, the rodent gourmet finds himself ideally placed to realize his dream.",2007-06-28,136.089,7.8,14035
884,22,Pirates of the Caribbean: The Curse of the Black Pearl,"Jack Sparrow, a freewheeling 18th-century pirate, quarrels with a rival pirate bent on pillaging Port Royal. When the governor's daughter is kidnapped, Sparrow decides to help the girl's love save her.",2003-07-09,250.94,7.8,17581
885,399566,Godzilla vs. Kong,"In a time when monsters walk the Earth, humanity’s fight for its future sets Godzilla and Kong on a collision course that will see the two most powerful forces of nature on the planet collide in a spectacular battle for the ages.",2021-03-24,265.67,7.8,7981
886,14069,The Girl Who Leapt Through Time,"When 17-year-old Makoto Konno gains the ability to, quite literally, ""leap"" backwards through time, she immediately sets about improving her grades and preventing personal mishaps. However, she soon realises that changing the past isn't as simple as it seems, and eventually, will have to rely on her new powers to shape the future of herself and her friends.",2006-07-15,30.823,7.8,1607
887,709629,War of Likes,"In order to advance her career in the dynamic world of publicity in Mexico City, Raquel tries to reunite with her high school friend Cecy who has become the queen of social media. But unlike followers, friendships do not come instantly.",2021-03-12,41.415,7.8,227
888,16237,Teen Titans: Trouble in Tokyo,"America's coolest heroes, the Teen Titans, go to Tokyo to track down the mysterious Japanese criminal Brushogun.",2006-09-15,23.856,7.8,275
889,492188,Marriage Story,"A stage director and an actress struggle through a grueling, coast-to-coast divorce that pushes them to their personal extremes.",2019-09-28,20.863,7.8,5752
890,486589,Red Shoes and the Seven Dwarfs,"Princes who have been turned into Dwarfs seek the red shoes of a lady in order to break the spell, although it will not be easy.",2019-07-25,78.534,7.8,861
891,9421,The Dinner Game,"For Pierre Brochant and his friends, Wednesday is “Idiots' Day”. The idea is simple: each person has to bring along an idiot. The one who brings the most spectacular idiot wins the prize. Tonight, Brochant is ecstatic. He has found a gem. The ultimate idiot, “A world champion idiot!”. What Brochant doesn’t know is that Pignon is a real jinx, a past master in the art of bringing on catastrophes...",1998-04-15,8.862,7.8,1522
892,583,Life of Brian,"Brian Cohen is an average young Jewish man, but through a series of ridiculous events, he gains a reputation as the Messiah. When he's not dodging his followers or being scolded by his shrill mother, the hapless Brian has to contend with the pompous Pontius Pilate and acronym-obsessed members of a separatist movement. Rife with Monty Python's signature absurdity, the tale finds Brian's life paralleling Biblical lore, albeit with many more laughs.",1979-08-17,14.393,7.8,3517
893,810171,The Valet,"World famous movie star Olivia faces a PR disaster when a paparazzi snaps a photo of her with her married lover, Vincent. The hard-working valet Antonio accidentally appears in the same photo and is enlisted to pose as Olivia’s new boyfriend as a cover-up. This ruse with Olivia thrusts Antonio into the spotlight and unexpected chaos.",2022-05-11,760.715,7.8,212
894,451945,BPM (Beats per Minute),"Paris, in the early 1990s: a group of young activists is desperately tied to finding the cure against an unknown lethal disease. They target the pharmaceutical labs that are retaining potential cures, and multiply direct actions, with the hope of saving their lives as well as the ones of future generations.",2017-08-23,8.358,7.8,1178
895,221732,Rurouni Kenshin Part III: The Legend Ends,"Shishio sets sail in his ironclad ship to bring down the government. In order to stop him, Kenshin trains with his old master to learn his final technique.",2014-09-13,17.315,7.8,355
896,11621,Porco Rosso,"In Italy in the 1930s, sky pirates in biplanes terrorize wealthy cruise ships as they sail the Adriatic Sea. The only pilot brave enough to stop the scourge is the mysterious Porco Rosso, a former World War I flying ace who was somehow turned into a pig during the war. As he prepares to battle the pirate crew's American ace, Porco Rosso enlists the help of spunky girl mechanic Fio Piccolo and his longtime friend Madame Gina.",1992-07-18,28.72,7.8,2497
897,2108,The Breakfast Club,"Five high school students from different walks of life endure a Saturday detention under a power-hungry principal. The disparate group includes rebel John, princess Claire, outcast Allison, brainy Brian and Andrew, the jock. Each has a chance to tell his or her story, making the others see them a little differently -- and when the day ends, they question whether school will ever be the same.",1985-02-15,14.783,7.8,6818
